{
  "gid": "559bef42c09b7",
  "created_at": "2014-09-08T22:47:31-08:00",
  "modified_at": "2014-09-08T22:47:31-08:00",
  "author": {
    "gid": "559bef4a9b600"
  },
  "worker": null,
  "message": "Lorem ipsum dolor sit amet, consectetur adipiscing elit. Cras scelerisque viverra sodales. Vestibulum quis fringilla nisi. Donec congue neque ac consequat vestibulum. Praesent sed urna maximus ante ornare vestibulum. In in vulputate sapien. Ut elementum bibendum mi sit amet congue. Aliquam suscipit turpis vitae dapibus efficitur. Nullam quis lacinia ligula. Nam at lectus sem.",
  "mine": true,
  "uri": "/works/559bef4a9b600",
  "nickname": "Bernard L."
}